2025-12-01 08:59:42,813 - INFO - ================================================================================
2025-12-01 08:59:42,813 - INFO - Compile MoRF Interfaces
2025-12-01 08:59:42,813 - INFO - ================================================================================
2025-12-01 08:59:42,813 - INFO - Output file: data/MoRF2/morf_interfaces.csv
2025-12-01 08:59:42,813 - INFO - Map DisProt/IDEAL IDs to UniProt: True
2025-12-01 08:59:42,813 - INFO - 
2025-12-01 08:59:42,813 - INFO - Compiling MoRF data from FASTA files...
2025-12-01 08:59:42,813 - INFO - Parsing /home/htsofie/Desktop/phospho_root/data/MoRF2/CV1.af...
2025-12-01 08:59:42,818 - INFO -   Extracted 141 entries from /home/htsofie/Desktop/phospho_root/data/MoRF2/CV1.af
2025-12-01 08:59:42,818 - INFO - Parsing /home/htsofie/Desktop/phospho_root/data/MoRF2/CV2.af...
2025-12-01 08:59:42,824 - INFO -   Extracted 182 entries from /home/htsofie/Desktop/phospho_root/data/MoRF2/CV2.af
2025-12-01 08:59:42,824 - INFO - Parsing /home/htsofie/Desktop/phospho_root/data/MoRF2/CV3.af...
2025-12-01 08:59:42,830 - INFO -   Extracted 192 entries from /home/htsofie/Desktop/phospho_root/data/MoRF2/CV3.af
2025-12-01 08:59:42,830 - INFO - Parsing /home/htsofie/Desktop/phospho_root/data/MoRF2/CV4.af...
2025-12-01 08:59:42,837 - INFO -   Extracted 198 entries from /home/htsofie/Desktop/phospho_root/data/MoRF2/CV4.af
2025-12-01 08:59:42,837 - INFO - Total entries compiled: 713
2025-12-01 08:59:42,837 - INFO - Mapping Disprot/Ideal IDs to UniProt...
2025-12-01 08:59:42,839 - INFO -   Found 476 IDs to map
2025-12-01 08:59:42,839 - INFO -   Mapping IID00151 (IDEAL)...
2025-12-01 08:59:44,741 - INFO -     -> P49792
2025-12-01 08:59:44,742 - INFO -   Mapping IID00400 (IDEAL)...
2025-12-01 08:59:46,505 - INFO -     -> Q9UMN6
2025-12-01 08:59:46,506 - INFO -   Mapping DP00653 (DisProt)...
2025-12-01 08:59:48,309 - INFO -     -> P26039
2025-12-01 08:59:48,309 - INFO -   Mapping IID00109 (IDEAL)...
2025-12-01 08:59:50,131 - INFO -     -> Q9Y618
2025-12-01 08:59:50,132 - INFO -   Mapping IID00610 (IDEAL)...
2025-12-01 08:59:51,927 - INFO -     -> Q13085
2025-12-01 08:59:51,928 - INFO -   Mapping DP01269 (DisProt)...
2025-12-01 08:59:53,680 - INFO -     -> Q8NG31
2025-12-01 08:59:53,680 - INFO -   Mapping DP02398 (DisProt)...
2025-12-01 08:59:55,469 - INFO -     -> Q04637
2025-12-01 08:59:55,470 - INFO -   Mapping IID50297 (IDEAL)...
2025-12-01 08:59:57,236 - INFO -     -> G0SDW4
2025-12-01 08:59:57,237 - INFO -   Mapping DP00609 (DisProt)...
2025-12-01 08:59:58,933 - INFO -     -> O81283
2025-12-01 08:59:58,934 - INFO -   Mapping DP00610 (DisProt)...
2025-12-01 09:00:00,588 - INFO -     -> Q9SLF3
2025-12-01 09:00:00,589 - INFO -   Mapping IID00009 (IDEAL)...
2025-12-01 09:00:02,395 - INFO -     -> O60341
2025-12-01 09:00:02,395 - INFO -   Mapping IID50235 (IDEAL)...
2025-12-01 09:00:04,050 - INFO -     -> Q9JIK5
2025-12-01 09:00:04,050 - INFO -   Mapping DP02262 (DisProt)...
2025-12-01 09:00:05,822 - INFO -     -> P42226
2025-12-01 09:00:05,822 - INFO -   Mapping IID00546 (IDEAL)...
2025-12-01 09:00:07,699 - INFO -     -> P21802
2025-12-01 09:00:07,699 - INFO -   Mapping DP01491 (DisProt)...
2025-12-01 09:00:09,483 - INFO -     -> P22059
2025-12-01 09:00:09,483 - INFO -   Mapping IID00535 (IDEAL)...
2025-12-01 09:00:11,308 - INFO -     -> P04629
2025-12-01 09:00:11,309 - INFO -   Mapping DP01651 (DisProt)...
2025-12-01 09:00:13,139 - INFO -     -> Q96T88
2025-12-01 09:00:13,140 - INFO -   Mapping DP00392 (DisProt)...
2025-12-01 09:00:14,940 - INFO -     -> Q09161
2025-12-01 09:00:14,941 - INFO -   Mapping IID90009 (IDEAL)...
2025-12-01 09:00:16,575 - INFO -     -> P61875
2025-12-01 09:00:16,575 - INFO -   Mapping DP01817 (DisProt)...
2025-12-01 09:00:18,411 - INFO -     -> Q15910
2025-12-01 09:00:18,412 - INFO -   Mapping DP00707 (DisProt)...
2025-12-01 09:00:20,200 - INFO -     -> Q9UER7
2025-12-01 09:00:20,200 - INFO -   Mapping DP01333 (DisProt)...
2025-12-01 09:00:21,946 - INFO -     -> O00522
2025-12-01 09:00:21,946 - INFO -   Mapping DP01255 (DisProt)...
2025-12-01 09:00:23,744 - INFO -     -> P13010
2025-12-01 09:00:23,744 - INFO -   Mapping DP02015 (DisProt)...
2025-12-01 09:00:25,488 - INFO -     -> P52272
2025-12-01 09:00:25,488 - INFO -   Mapping DP01112 (DisProt)...
2025-12-01 09:00:27,315 - INFO -     -> P27986
2025-12-01 09:00:27,316 - INFO -   Mapping DP00222 (DisProt)...
2025-12-01 09:00:28,973 - INFO -     -> P32499
2025-12-01 09:00:28,974 - INFO -   Mapping DP01994 (DisProt)...
2025-12-01 09:00:30,639 - INFO -     -> P27321
2025-12-01 09:00:30,639 - INFO -   Mapping DP00086 (DisProt)...
2025-12-01 09:00:32,826 - INFO -     -> P04637
2025-12-01 09:00:32,827 - INFO -   Mapping DP00319 (DisProt)...
2025-12-01 09:00:34,619 - INFO -     -> O15350
2025-12-01 09:00:34,619 - INFO -   Mapping DP01123 (DisProt)...
2025-12-01 09:00:36,423 - INFO -     -> P43403
2025-12-01 09:00:36,424 - INFO -   Mapping IID00452 (IDEAL)...
2025-12-01 09:00:38,094 - INFO -     -> P48382
2025-12-01 09:00:38,095 - INFO -   Mapping IID50197 (IDEAL)...
2025-12-01 09:00:39,728 - INFO -     -> P07313
2025-12-01 09:00:39,729 - INFO -   Mapping DP01115 (DisProt)...
2025-12-01 09:00:41,520 - INFO -     -> Q16236
2025-12-01 09:00:41,521 - INFO -   Mapping DP00428 (DisProt)...
2025-12-01 09:01:37,772 - WARNING - Job status is None for DP00428 after 30 attempts
2025-12-01 09:01:37,925 - WARNING -     -> Mapping failed
2025-12-01 09:01:37,925 - INFO -   Mapping DP00074 (DisProt)...
2025-12-01 09:01:39,795 - INFO -     -> P03372
2025-12-01 09:01:39,796 - INFO -   Mapping DP01852 (DisProt)...
2025-12-01 09:01:41,453 - INFO -     -> P04480
2025-12-01 09:01:41,454 - INFO -   Mapping DP03201 (DisProt)...
2025-12-01 09:02:38,134 - WARNING - Job status is None for DP03201 after 30 attempts
2025-12-01 09:02:38,292 - WARNING -     -> Mapping failed
2025-12-01 09:02:38,293 - INFO -   Mapping IID00099 (IDEAL)...
2025-12-01 09:02:39,977 - INFO -     -> Q99741
2025-12-01 09:02:39,978 - INFO -   Mapping IID50108 (IDEAL)...
2025-12-01 09:02:41,677 - INFO -     -> Q9Z2D7
2025-12-01 09:02:41,680 - INFO -   Mapping DP01797 (DisProt)...
2025-12-01 09:02:43,660 - INFO -     -> O96017
2025-12-01 09:02:43,661 - INFO -   Mapping DP00640 (DisProt)...
2025-12-01 09:03:39,920 - WARNING - Job status is None for DP00640 after 30 attempts
2025-12-01 09:03:40,073 - WARNING -     -> Mapping failed
2025-12-01 09:03:40,073 - INFO -   Mapping DP01171 (DisProt)...
2025-12-01 09:03:41,860 - INFO -     -> P42768
2025-12-01 09:03:41,860 - INFO -   Mapping DP03919 (DisProt)...
2025-12-01 09:04:38,240 - WARNING - Job status is None for DP03919 after 30 attempts
2025-12-01 09:04:38,392 - WARNING -     -> Mapping failed
2025-12-01 09:04:38,392 - INFO -   Mapping DP03292 (DisProt)...
2025-12-01 09:05:34,663 - WARNING - Job status is None for DP03292 after 30 attempts
2025-12-01 09:05:34,816 - WARNING -     -> Mapping failed
2025-12-01 09:05:34,817 - INFO -   Mapping DP01319 (DisProt)...
2025-12-01 09:05:36,615 - INFO -     -> Q15796
2025-12-01 09:05:36,615 - INFO -   Mapping DP01206 (DisProt)...
2025-12-01 09:05:38,394 - INFO -     -> Q15797
2025-12-01 09:05:38,395 - INFO -   Mapping DP04092 (DisProt)...
2025-12-01 09:06:34,694 - WARNING - Job status is None for DP04092 after 30 attempts
2025-12-01 09:06:34,846 - WARNING -     -> Mapping failed
2025-12-01 09:06:34,847 - INFO -   Mapping DP00123 (DisProt)...
2025-12-01 09:07:31,455 - WARNING - Job status is None for DP00123 after 30 attempts
2025-12-01 09:07:31,607 - WARNING -     -> Mapping failed
2025-12-01 09:07:31,607 - INFO -   Mapping DP02850 (DisProt)...
2025-12-01 09:07:33,293 - INFO -     -> O60239
2025-12-01 09:07:33,294 - INFO -   Mapping DP00897 (DisProt)...
2025-12-01 09:07:34,957 - INFO -     -> Q57565
2025-12-01 09:07:34,957 - INFO -   Mapping DP02860 (DisProt)...
2025-12-01 09:07:36,731 - INFO -     -> P55211
2025-12-01 09:07:36,732 - INFO -   Mapping IID00355 (IDEAL)...
2025-12-01 09:07:38,399 - INFO -     -> P10600
2025-12-01 09:07:38,399 - INFO -   Mapping DP00461 (DisProt)...
2025-12-01 09:07:40,072 - INFO -     -> P08083
2025-12-01 09:07:40,072 - INFO -   Mapping DP00613 (DisProt)...
2025-12-01 09:07:41,703 - INFO -     -> Q22472
2025-12-01 09:07:41,704 - INFO -   Mapping DP03435 (DisProt)...
2025-12-01 09:08:37,911 - WARNING - Job status is None for DP03435 after 30 attempts
2025-12-01 09:08:38,064 - WARNING -     -> Mapping failed
2025-12-01 09:08:38,064 - INFO -   Mapping DP00937 (DisProt)...
2025-12-01 09:08:39,783 - INFO -     -> Q12972
2025-12-01 09:08:39,784 - INFO -   Mapping DP00271 (DisProt)...
2025-12-01 09:08:41,556 - INFO -     -> P02699
2025-12-01 09:08:41,557 - INFO -   Mapping DP01339 (DisProt)...
2025-12-01 09:08:43,212 - INFO -     -> P0A903
2025-12-01 09:08:43,213 - INFO -   Mapping DP03141 (DisProt)...
2025-12-01 09:09:39,304 - WARNING - Job status is None for DP03141 after 30 attempts
2025-12-01 09:09:39,456 - WARNING -     -> Mapping failed
2025-12-01 09:09:39,457 - INFO -   Mapping DP01150 (DisProt)...
2025-12-01 09:09:41,112 - INFO -     -> P03255
2025-12-01 09:09:41,112 - INFO -   Mapping DP00083 (DisProt)...
2025-12-01 09:09:42,873 - INFO -     -> P03069
2025-12-01 09:09:42,874 - INFO -   Mapping DP02001 (DisProt)...
2025-12-01 09:09:44,573 - INFO -     -> O08807
2025-12-01 09:09:44,574 - INFO -   Mapping DP00356 (DisProt)...
2025-12-01 09:09:46,278 - INFO -     -> Q99967
2025-12-01 09:09:46,279 - INFO -   Mapping DP01308 (DisProt)...
2025-12-01 09:09:48,041 - INFO -     -> O60828
2025-12-01 09:09:48,042 - INFO -   Mapping DP01283 (DisProt)...
2025-12-01 09:09:49,736 - INFO -     -> Q9Y3E7
2025-12-01 09:09:49,736 - INFO -   Mapping IID00509 (IDEAL)...
2025-12-01 09:09:51,454 - INFO -     -> P10747
2025-12-01 09:09:51,455 - INFO -   Mapping DP01144 (DisProt)...
2025-12-01 09:09:53,107 - INFO -     -> P08008
2025-12-01 09:09:53,108 - INFO -   Mapping DP01364 (DisProt)...
2025-12-01 09:09:54,940 - INFO -     -> P62826
2025-12-01 09:09:54,941 - INFO -   Mapping DP02539 (DisProt)...
2025-12-01 09:09:56,633 - INFO -     -> Q16611
2025-12-01 09:09:56,633 - INFO -   Mapping DP00901 (DisProt)...
2025-12-01 09:09:58,320 - INFO -     -> O75496
2025-12-01 09:09:58,320 - INFO -   Mapping DP02412 (DisProt)...
2025-12-01 09:09:59,969 - INFO -     -> O88513
2025-12-01 09:09:59,970 - INFO -   Mapping DP03580 (DisProt)...
2025-12-01 09:10:56,284 - WARNING - Job status is None for DP03580 after 30 attempts
2025-12-01 09:10:56,436 - WARNING -     -> Mapping failed
2025-12-01 09:10:56,437 - INFO -   Mapping DP00521 (DisProt)...
2025-12-01 09:10:58,113 - INFO -     -> O95997
2025-12-01 09:10:58,113 - INFO -   Mapping DP00645 (DisProt)...
2025-12-01 09:10:59,776 - INFO -     -> Q91ZE9
2025-12-01 09:10:59,776 - INFO -   Mapping IID50312 (IDEAL)...
2025-12-01 09:11:01,406 - INFO -     -> P20797
2025-12-01 09:11:01,408 - INFO -   Mapping DP00084 (DisProt)...
2025-12-01 09:11:57,563 - WARNING - Job status is None for DP00084 after 30 attempts
2025-12-01 09:11:57,715 - WARNING -     -> Mapping failed
2025-12-01 09:11:57,716 - INFO -   Mapping DP01135 (DisProt)...
2025-12-01 09:11:59,346 - INFO -     -> P40019
2025-12-01 09:11:59,347 - INFO -   Mapping DP01389 (DisProt)...
2025-12-01 09:12:01,120 - INFO -     -> P84233
2025-12-01 09:12:01,120 - INFO -   Mapping DP00070 (DisProt)...
2025-12-01 09:12:02,903 - INFO -     -> P37840
2025-12-01 09:12:02,904 - INFO -   Mapping DP00958 (DisProt)...
2025-12-01 09:12:04,539 - INFO -     -> P46984
2025-12-01 09:12:04,540 - INFO -   Mapping DP00810 (DisProt)...
2025-12-01 09:12:06,170 - INFO -     -> P0A882
2025-12-01 09:12:06,170 - INFO -   Mapping DP01435 (DisProt)...
2025-12-01 09:12:07,856 - INFO -     -> O60829
2025-12-01 09:12:07,857 - INFO -   Mapping DP01181 (DisProt)...
2025-12-01 09:12:09,469 - INFO -     -> P56621
2025-12-01 09:12:09,470 - INFO -   Mapping DP01970 (DisProt)...
2025-12-01 09:12:11,093 - INFO -     -> M1GUG5
2025-12-01 09:12:11,094 - INFO -   Mapping DP01147 (DisProt)...
2025-12-01 09:12:12,724 - INFO -     -> Q9I322
2025-12-01 09:12:12,725 - INFO -   Mapping DP00759 (DisProt)...
2025-12-01 09:12:14,345 - INFO -     -> P80220
2025-12-01 09:12:14,346 - INFO -   Mapping DP01510 (DisProt)...
2025-12-01 09:12:15,974 - INFO -     -> O25010
2025-12-01 09:12:15,975 - INFO -   Mapping DP02951 (DisProt)...
2025-12-01 09:12:17,638 - INFO -     -> P01501
2025-12-01 09:12:17,639 - INFO -   Mapping DP00179 (DisProt)...
2025-12-01 09:12:19,264 - INFO -     -> P01094
2025-12-01 09:12:19,264 - INFO -   Mapping DP01676 (DisProt)...
2025-12-01 09:13:15,236 - WARNING - Job status is None for DP01676 after 30 attempts
2025-12-01 09:13:15,388 - WARNING -     -> Mapping failed
2025-12-01 09:13:15,388 - INFO -   Mapping DP01272 (DisProt)...
2025-12-01 09:13:17,152 - INFO -     -> Q03132
2025-12-01 09:13:17,153 - INFO -   Mapping IID00189 (IDEAL)...
2025-12-01 09:13:18,928 - INFO -     -> O75376
2025-12-01 09:13:18,928 - INFO -   Mapping DP01284 (DisProt)...
2025-12-01 09:13:20,782 - INFO -     -> P24928
2025-12-01 09:13:20,783 - INFO -   Mapping IID00087 (IDEAL)...
2025-12-01 09:13:22,544 - INFO -     -> Q6W2J9
2025-12-01 09:13:22,545 - INFO -   Mapping IID00358 (IDEAL)...
2025-12-01 09:13:24,226 - INFO -     -> O15047
2025-12-01 09:13:24,226 - INFO -   Mapping DP02401 (DisProt)...
2025-12-01 09:13:25,869 - INFO -     -> O61380
2025-12-01 09:13:25,869 - INFO -   Mapping IID00173 (IDEAL)...
2025-12-01 09:13:27,696 - INFO -     -> Q15648
2025-12-01 09:13:27,696 - INFO -   Mapping IID50031 (IDEAL)...
2025-12-01 09:13:29,875 - INFO -     -> A1L0Z0
2025-12-01 09:13:29,875 - INFO -   Mapping DP01985 (DisProt)...
2025-12-01 09:13:31,622 - INFO -     -> Q8TEK3
2025-12-01 09:13:31,622 - INFO -   Mapping DP02295 (DisProt)...
2025-12-01 09:13:33,291 - INFO -     -> Q05471
2025-12-01 09:13:33,292 - INFO -   Mapping DP04062 (DisProt)...
2025-12-01 09:14:29,406 - WARNING - Job status is None for DP04062 after 30 attempts
2025-12-01 09:14:29,559 - WARNING -     -> Mapping failed
2025-12-01 09:14:29,559 - INFO -   Mapping DP00012 (DisProt)...
2025-12-01 09:14:31,548 - INFO -     -> P13569
2025-12-01 09:14:31,549 - INFO -   Mapping DP03695 (DisProt)...
2025-12-01 09:15:28,257 - WARNING - Job status is None for DP03695 after 30 attempts
2025-12-01 09:15:28,409 - WARNING -     -> Mapping failed
2025-12-01 09:15:28,410 - INFO -   Mapping DP00141 (DisProt)...
2025-12-01 09:16:25,412 - WARNING - Job status is None for DP00141 after 30 attempts
2025-12-01 09:16:25,565 - WARNING -     -> Mapping failed
2025-12-01 09:16:25,566 - INFO -   Mapping IID90040 (IDEAL)...
2025-12-01 09:16:27,436 - INFO -     -> Q99ZW2
2025-12-01 09:16:27,437 - INFO -   Mapping DP01851 (DisProt)...
2025-12-01 09:16:29,265 - INFO -     -> P10686
2025-12-01 09:16:29,266 - INFO -   Mapping DP03016 (DisProt)...
2025-12-01 09:16:31,142 - INFO -     -> P11274
2025-12-01 09:16:31,143 - INFO -   Mapping DP01484 (DisProt)...
2025-12-01 09:16:33,043 - INFO -     -> P04626
2025-12-01 09:16:33,044 - INFO -   Mapping DP00309 (DisProt)...
2025-12-01 09:17:30,081 - WARNING - Job status is None for DP00309 after 30 attempts
2025-12-01 09:17:30,236 - WARNING -     -> Mapping failed
2025-12-01 09:17:30,237 - INFO -   Mapping DP00448 (DisProt)...
2025-12-01 09:17:32,060 - INFO -     -> Q9Y613
2025-12-01 09:17:32,061 - INFO -   Mapping IID00050 (IDEAL)...
2025-12-01 09:17:33,912 - INFO -     -> P48552
2025-12-01 09:17:33,913 - INFO -   Mapping DP01075 (DisProt)...
2025-12-01 09:17:35,723 - INFO -     -> P20676
2025-12-01 09:17:35,725 - INFO -   Mapping DP01867 (DisProt)...
2025-12-01 09:17:37,488 - INFO -     -> P47047
2025-12-01 09:17:37,490 - INFO -   Mapping DP01139 (DisProt)...
2025-12-01 09:17:39,198 - INFO -     -> A0A0G2JXC5
2025-12-01 09:17:39,199 - INFO -   Mapping DP01472 (DisProt)...
2025-12-01 09:17:40,915 - INFO -     -> Q6GX35
2025-12-01 09:17:40,917 - INFO -   Mapping DP02292 (DisProt)...
2025-12-01 09:17:42,773 - INFO -     -> Q96PU5
2025-12-01 09:17:42,774 - INFO -   Mapping DP02758 (DisProt)...
2025-12-01 09:17:44,691 - INFO -     -> Q13563
2025-12-01 09:17:44,693 - INFO -   Mapping DP01436 (DisProt)...
2025-12-01 09:17:46,396 - INFO -     -> P54936
2025-12-01 09:17:46,399 - INFO -   Mapping DP02887 (DisProt)...
2025-12-01 09:17:48,112 - INFO -     -> P62944
2025-12-01 09:17:48,114 - INFO -   Mapping DP01542 (DisProt)...
2025-12-01 09:17:49,950 - INFO -     -> P06401
2025-12-01 09:17:49,952 - INFO -   Mapping IID50172 (IDEAL)...
2025-12-01 09:17:51,669 - INFO -     -> P34160
2025-12-01 09:17:51,672 - INFO -   Mapping DP01396 (DisProt)...
2025-12-01 09:17:53,636 - INFO -     -> P01130
2025-12-01 09:17:53,638 - INFO -   Mapping DP03930 (DisProt)...
2025-12-01 09:18:50,771 - WARNING - Job status is None for DP03930 after 30 attempts
2025-12-01 09:18:50,928 - WARNING -     -> Mapping failed
2025-12-01 09:18:50,928 - INFO -   Mapping DP01748 (DisProt)...
2025-12-01 09:18:52,904 - INFO -     -> P05556
2025-12-01 09:18:52,904 - INFO -   Mapping DP01842 (DisProt)...
2025-12-01 09:18:54,823 - INFO -     -> P05106
2025-12-01 09:18:54,824 - INFO -   Mapping DP01848 (DisProt)...
2025-12-01 09:18:56,673 - INFO -     -> P05107
2025-12-01 09:18:56,674 - INFO -   Mapping DP02715 (DisProt)...
2025-12-01 09:18:58,455 - INFO -     -> P00452
2025-12-01 09:18:58,456 - INFO -   Mapping DP02840 (DisProt)...
2025-12-01 09:19:00,346 - INFO -     -> O60934
2025-12-01 09:19:00,347 - INFO -   Mapping IID00434 (IDEAL)...
2025-12-01 09:19:02,097 - INFO -     -> O75175
2025-12-01 09:19:02,098 - INFO -   Mapping DP01482 (DisProt)...
2025-12-01 09:19:03,773 - INFO -     -> O13828
2025-12-01 09:19:03,774 - INFO -   Mapping IID00227 (IDEAL)...
2025-12-01 09:19:05,535 - INFO -     -> Q9UQF2
2025-12-01 09:19:05,538 - INFO -   Mapping DP00699 (DisProt)...
2025-12-01 09:19:07,228 - INFO -     -> Q9IK91
2025-12-01 09:19:07,230 - INFO -   Mapping DP03001 (DisProt)...
2025-12-01 09:19:08,921 - INFO -     -> O55777
2025-12-01 09:19:08,923 - INFO -   Mapping IID00433 (IDEAL)...
2025-12-01 09:19:10,764 - INFO -     -> O43524
2025-12-01 09:19:10,765 - INFO -   Mapping DP00128 (DisProt)...
2025-12-01 09:19:12,484 - INFO -     -> P40357
2025-12-01 09:19:12,487 - INFO -   Mapping DP03100 (DisProt)...
2025-12-01 09:20:09,594 - WARNING - Job status is None for DP03100 after 30 attempts
2025-12-01 09:20:09,751 - WARNING -     -> Mapping failed
2025-12-01 09:20:09,751 - INFO -   Mapping DP01990 (DisProt)...
2025-12-01 09:20:11,462 - INFO -     -> P36894
2025-12-01 09:20:11,463 - INFO -   Mapping IID00413 (IDEAL)...
2025-12-01 09:20:14,043 - INFO -     -> P36897
2025-12-01 09:20:14,045 - INFO -   Mapping DP00092 (DisProt)...
2025-12-01 09:20:15,903 - INFO -     -> Q08209
2025-12-01 09:20:15,905 - INFO -   Mapping DP01925 (DisProt)...
2025-12-01 09:20:17,752 - INFO -     -> Q02078
2025-12-01 09:20:17,753 - INFO -   Mapping DP00718 (DisProt)...
2025-12-01 09:20:19,653 - INFO -     -> P37231
2025-12-01 09:20:19,655 - INFO -   Mapping IID50189 (IDEAL)...
2025-12-01 09:20:21,330 - INFO -     -> Q07346
2025-12-01 09:20:21,331 - INFO -   Mapping DP01461 (DisProt)...
2025-12-01 09:20:23,173 - INFO -     -> Q13188
2025-12-01 09:20:23,174 - INFO -   Mapping DP03682 (DisProt)...
2025-12-01 09:21:20,353 - WARNING - Job status is None for DP03682 after 30 attempts
2025-12-01 09:21:20,508 - WARNING -     -> Mapping failed
2025-12-01 09:21:20,509 - INFO -   Mapping DP00304 (DisProt)...
2025-12-01 09:21:22,349 - INFO -     -> P31751
2025-12-01 09:21:22,351 - INFO -   Mapping DP01560 (DisProt)...
2025-12-01 09:21:24,093 - INFO -     -> Q9UMR2
2025-12-01 09:21:24,096 - INFO -   Mapping DP02126 (DisProt)...
2025-12-01 09:21:25,905 - INFO -     -> P30307
2025-12-01 09:21:25,906 - INFO -   Mapping DP01528 (DisProt)...
2025-12-01 09:21:27,578 - INFO -     -> P15273
2025-12-01 09:21:27,579 - INFO -   Mapping DP01879 (DisProt)...
2025-12-01 09:21:29,301 - INFO -     -> Q9JIH2
2025-12-01 09:21:29,303 - INFO -   Mapping IID00679 (IDEAL)...
2025-12-01 09:21:31,043 - INFO -     -> Q9BUB5
2025-12-01 09:21:31,044 - INFO -   Mapping IID00172 (IDEAL)...
2025-12-01 09:21:32,853 - INFO -     -> Q15208
2025-12-01 09:21:32,854 - INFO -   Mapping DP00662 (DisProt)...
2025-12-01 09:21:34,600 - INFO -     -> Q8LBP4
2025-12-01 09:21:34,602 - INFO -   Mapping DP02251 (DisProt)...
2025-12-01 09:21:36,448 - INFO -     -> P68363
2025-12-01 09:21:36,448 - INFO -   Mapping DP00111 (DisProt)...
2025-12-01 09:21:38,203 - INFO -     -> P27577
2025-12-01 09:21:38,204 - INFO -   Mapping DP01427 (DisProt)...
2025-12-01 09:21:40,029 - INFO -     -> Q01094
2025-12-01 09:21:40,030 - INFO -   Mapping DP00487 (DisProt)...
2025-12-01 09:21:41,766 - INFO -     -> P09938
2025-12-01 09:21:41,767 - INFO -   Mapping DP00462 (DisProt)...
2025-12-01 09:21:43,495 - INFO -     -> P11157
2025-12-01 09:21:43,496 - INFO -   Mapping DP02254 (DisProt)...
2025-12-01 09:21:45,344 - INFO -     -> P14598
2025-12-01 09:21:45,345 - INFO -   Mapping DP00278 (DisProt)...
2025-12-01 09:21:47,117 - INFO -     -> P08050
2025-12-01 09:21:47,118 - INFO -   Mapping DP00245 (DisProt)...
2025-12-01 09:21:48,812 - INFO -     -> P00514
2025-12-01 09:21:48,814 - INFO -   Mapping DP01192 (DisProt)...
2025-12-01 09:21:50,622 - INFO -     -> P55036
2025-12-01 09:21:50,623 - INFO -   Mapping DP01366 (DisProt)...
2025-12-01 09:21:52,306 - INFO -     -> Q24139
2025-12-01 09:21:52,307 - INFO -   Mapping DP01782 (DisProt)...
2025-12-01 09:21:54,012 - INFO -     -> Q53GG5
2025-12-01 09:21:54,013 - INFO -   Mapping DP01646 (DisProt)...
2025-12-01 09:21:55,808 - INFO -     -> P35236
2025-12-01 09:21:55,810 - INFO -   Mapping DP01874 (DisProt)...
2025-12-01 09:21:57,600 - INFO -     -> O95149
2025-12-01 09:21:57,601 - INFO -   Mapping IID00486 (IDEAL)...
2025-12-01 09:21:59,454 - INFO -     -> Q8N6T7
2025-12-01 09:21:59,455 - INFO -   Mapping IID00075 (IDEAL)...
2025-12-01 09:22:01,309 - INFO -     -> Q14103
2025-12-01 09:22:01,310 - INFO -   Mapping DP01249 (DisProt)...
2025-12-01 09:22:03,134 - INFO -     -> P61073
2025-12-01 09:22:03,135 - INFO -   Mapping DP00273 (DisProt)...
2025-12-01 09:22:04,872 - INFO -     -> P04695
2025-12-01 09:22:04,873 - INFO -   Mapping DP02904 (DisProt)...
2025-12-01 09:22:06,555 - INFO -     -> Q8NBI3
2025-12-01 09:22:06,556 - INFO -   Mapping DP01951 (DisProt)...
2025-12-01 09:22:08,316 - INFO -     -> P04083
2025-12-01 09:22:08,317 - INFO -   Mapping DP02735 (DisProt)...
2025-12-01 09:22:10,154 - INFO -     -> P07355
2025-12-01 09:22:10,156 - INFO -   Mapping DP01603 (DisProt)...
2025-12-01 09:22:11,906 - INFO -     -> Q96IZ0
2025-12-01 09:22:11,907 - INFO -   Mapping DP00940 (DisProt)...
2025-12-01 09:22:13,622 - INFO -     -> Q62627
2025-12-01 09:22:13,623 - INFO -   Mapping DP01185 (DisProt)...
2025-12-01 09:22:15,338 - INFO -     -> P46669
2025-12-01 09:22:15,339 - INFO -   Mapping DP03397 (DisProt)...
2025-12-01 09:23:12,517 - WARNING - Job status is None for DP03397 after 30 attempts
2025-12-01 09:23:12,670 - WARNING -     -> Mapping failed
2025-12-01 09:23:12,671 - INFO -   Mapping IID00600 (IDEAL)...
2025-12-01 09:23:14,410 - INFO -     -> Q5TBB1
2025-12-01 09:23:14,413 - INFO -   Mapping DP01437 (DisProt)...
2025-12-01 09:23:16,113 - INFO -     -> P90976
2025-12-01 09:23:16,115 - INFO -   Mapping DP00155 (DisProt)...
2025-12-01 09:23:17,861 - INFO -     -> P32851
2025-12-01 09:23:17,863 - INFO -   Mapping DP02373 (DisProt)...
2025-12-01 09:23:19,561 - INFO -     -> Q92837
2025-12-01 09:23:19,561 - INFO -   Mapping IID00711 (IDEAL)...
2025-12-01 09:23:21,311 - INFO -     -> P25942
2025-12-01 09:23:21,313 - INFO -   Mapping DP01501 (DisProt)...
2025-12-01 09:23:23,034 - INFO -     -> G3V7P1
2025-12-01 09:23:23,037 - INFO -   Mapping DP00783 (DisProt)...
2025-12-01 09:23:25,649 - INFO -     -> P10279
2025-12-01 09:23:25,650 - INFO -   Mapping IID00363 (IDEAL)...
2025-12-01 09:23:27,480 - INFO -     -> O95863
2025-12-01 09:23:27,481 - INFO -   Mapping DP00250 (DisProt)...
2025-12-01 09:23:29,158 - INFO -     -> P01555
2025-12-01 09:23:29,159 - INFO -   Mapping IID90015 (IDEAL)...
2025-12-01 09:23:30,892 - INFO -     -> O73947
2025-12-01 09:23:30,893 - INFO -   Mapping DP00614 (DisProt)...
2025-12-01 09:23:32,617 - INFO -     -> Q07412
2025-12-01 09:23:32,618 - INFO -   Mapping DP00836 (DisProt)...
2025-12-01 09:23:34,300 - INFO -     -> P01139
2025-12-01 09:23:34,301 - INFO -   Mapping DP01506 (DisProt)...
2025-12-01 09:23:36,158 - INFO -     -> P08263
2025-12-01 09:23:36,160 - INFO -   Mapping DP04003 (DisProt)...
2025-12-01 09:24:33,591 - WARNING - Job status is None for DP04003 after 30 attempts
2025-12-01 09:24:33,747 - WARNING -     -> Mapping failed
2025-12-01 09:24:33,748 - INFO -   Mapping IID90025 (IDEAL)...
2025-12-01 09:24:35,480 - INFO -     -> O29634
2025-12-01 09:24:35,482 - INFO -   Mapping DP00563 (DisProt)...
2025-12-01 09:24:37,154 - INFO -     -> Q61337
2025-12-01 09:24:37,157 - INFO -   Mapping DP01890 (DisProt)...
2025-12-01 09:24:38,895 - INFO -     -> Q07930
2025-12-01 09:24:38,896 - INFO -   Mapping IID50041 (IDEAL)...
2025-12-01 09:24:40,619 - INFO -     -> P19803
2025-12-01 09:24:40,620 - INFO -   Mapping IID00624 (IDEAL)...
2025-12-01 09:24:42,351 - INFO -     -> Q15672
2025-12-01 09:24:42,353 - INFO -   Mapping DP00217 (DisProt)...
2025-12-01 09:24:44,075 - INFO -     -> P05221
2025-12-01 09:24:44,076 - INFO -   Mapping DP00018 (DisProt)...
2025-12-01 09:24:45,871 - INFO -     -> P46527
2025-12-01 09:24:45,873 - INFO -   Mapping DP00652 (DisProt)...
2025-12-01 09:24:47,789 - INFO -     -> P00441
2025-12-01 09:24:47,791 - INFO -   Mapping DP01058 (DisProt)...
2025-12-01 09:24:49,505 - INFO -     -> Q9SIN5
2025-12-01 09:24:49,507 - INFO -   Mapping DP01057 (DisProt)...
2025-12-01 09:24:51,209 - INFO -     -> Q42512
2025-12-01 09:24:51,211 - INFO -   Mapping DP02149 (DisProt)...
2025-12-01 09:24:53,488 - INFO -     -> Q24570
2025-12-01 09:24:53,489 - INFO -   Mapping DP02346 (DisProt)...
2025-12-01 09:24:55,190 - INFO -     -> Q9BTL3
2025-12-01 09:24:55,191 - INFO -   Mapping DP00069 (DisProt)...
2025-12-01 09:25:52,936 - WARNING - Job status is None for DP00069 after 30 attempts
2025-12-01 09:25:53,091 - WARNING -     -> Mapping failed
2025-12-01 09:25:53,094 - INFO -   Mapping DP00793 (DisProt)...
2025-12-01 09:25:54,813 - INFO -     -> P05387
2025-12-01 09:25:54,813 - INFO -   Mapping DP01253 (DisProt)...
2025-12-01 09:25:59,488 - INFO -     -> P05386
2025-12-01 09:25:59,489 - INFO -   Mapping DP00005 (DisProt)...
2025-12-01 09:26:01,442 - INFO -     -> P03045
2025-12-01 09:26:01,443 - INFO -   Mapping DP00040 (DisProt)...
2025-12-01 09:26:03,271 - INFO -     -> P17096
2025-12-01 09:26:03,273 - INFO -   Mapping DP01289 (DisProt)...
2025-12-01 09:26:04,931 - INFO -     -> Q9KMA5
2025-12-01 09:26:04,933 - INFO -   Mapping DP01281 (DisProt)...
2025-12-01 09:26:06,642 - INFO -     -> Q9JM54
2025-12-01 09:26:06,643 - INFO -   Mapping DP01832 (DisProt)...
2025-12-01 09:26:08,338 - INFO -     -> Q7Q3R9
2025-12-01 09:26:08,340 - INFO -   Mapping DP00824 (DisProt)...
2025-12-01 09:26:10,055 - INFO -     -> Q9NJS1
2025-12-01 09:26:10,056 - INFO -   Mapping DP01430 (DisProt)...
2025-12-01 09:26:11,783 - INFO -     -> Q03071
2025-12-01 09:26:11,784 - INFO -   Mapping DP02261 (DisProt)...
2025-12-01 09:27:09,150 - WARNING - Job status is None for DP02261 after 30 attempts
2025-12-01 09:27:09,306 - WARNING -     -> Mapping failed
2025-12-01 09:27:09,307 - INFO -   Mapping DP00347 (DisProt)...
2025-12-01 09:27:11,032 - INFO -     -> P04972
2025-12-01 09:27:11,033 - INFO -   Mapping DP00995 (DisProt)...
2025-12-01 09:27:12,755 - INFO -     -> P01097
2025-12-01 09:27:12,758 - INFO -   Mapping DP02302 (DisProt)...
2025-12-01 09:27:14,472 - INFO -     -> Q15843
2025-12-01 09:27:14,474 - INFO -   Mapping DP01004 (DisProt)...
2025-12-01 09:27:16,170 - INFO -     -> Q9KJ82
2025-12-01 09:27:16,173 - INFO -   Mapping DP00928 (DisProt)...
2025-12-01 09:27:18,007 - INFO -     -> P62552
2025-12-01 09:27:18,008 - INFO -   Mapping IID50221 (IDEAL)...
2025-12-01 09:27:20,076 - INFO -     -> P98158
2025-12-01 09:27:20,076 - INFO -   Mapping DP02051 (DisProt)...
2025-12-01 09:28:17,522 - WARNING - Job status is None for DP02051 after 30 attempts
2025-12-01 09:28:17,678 - WARNING -     -> Mapping failed
2025-12-01 09:28:17,679 - INFO -   Mapping DP01245 (DisProt)...
2025-12-01 09:28:19,516 - INFO -     -> P12823
2025-12-01 09:28:19,518 - INFO -   Mapping DP01256 (DisProt)...
2025-12-01 09:28:21,541 - INFO -     -> Q32ZE1
2025-12-01 09:28:21,542 - INFO -   Mapping IID00580 (IDEAL)...
2025-12-01 09:28:23,374 - INFO -     -> Q99700
2025-12-01 09:28:23,376 - INFO -   Mapping IID50198 (IDEAL)...
2025-12-01 09:28:25,086 - INFO -     -> P14737
2025-12-01 09:28:25,088 - INFO -   Mapping DP01863 (DisProt)...
2025-12-01 09:28:26,975 - INFO -     -> O75533
2025-12-01 09:28:26,976 - INFO -   Mapping DP01277 (DisProt)...
2025-12-01 09:28:28,675 - INFO -     -> Q6VMQ6
2025-12-01 09:28:28,677 - INFO -   Mapping DP00999 (DisProt)...
2025-12-01 09:28:30,527 - INFO -     -> P03315
2025-12-01 09:28:30,528 - INFO -   Mapping IID00333 (IDEAL)...
2025-12-01 09:28:32,333 - INFO -     -> Q9ULH1
2025-12-01 09:28:32,334 - INFO -   Mapping IID50274 (IDEAL)...
2025-12-01 09:28:34,099 - INFO -     -> P35546
2025-12-01 09:28:34,100 - INFO -   Mapping DP03927 (DisProt)...
2025-12-01 09:28:35,792 - INFO -     -> W1J0W9
2025-12-01 09:28:35,793 - INFO -   Mapping IID00466 (IDEAL)...
2025-12-01 09:28:37,521 - INFO -     -> Q12968
2025-12-01 09:28:37,524 - INFO -   Mapping DP01724 (DisProt)...
2025-12-01 09:28:39,296 - INFO -     -> O95644
2025-12-01 09:28:39,297 - INFO -   Mapping DP02852 (DisProt)...
2025-12-01 09:28:41,109 - INFO -     -> P55197
2025-12-01 09:28:41,111 - INFO -   Mapping DP01117 (DisProt)...
2025-12-01 09:28:42,955 - INFO -     -> O60566
2025-12-01 09:28:42,956 - INFO -   Mapping DP01631 (DisProt)...
2025-12-01 09:28:44,667 - INFO -     -> P07276
2025-12-01 09:28:44,668 - INFO -   Mapping IID00154 (IDEAL)...
2025-12-01 09:28:47,061 - INFO -     -> P54198
2025-12-01 09:28:47,064 - INFO -   Mapping IID00220 (IDEAL)...
2025-12-01 09:28:48,774 - INFO -     -> Q92585
2025-12-01 09:28:48,777 - INFO -   Mapping DP00533 (DisProt)...
2025-12-01 09:28:50,535 - INFO -     -> P06701
2025-12-01 09:28:50,538 - INFO -   Mapping DP00082 (DisProt)...
2025-12-01 09:28:52,327 - INFO -     -> P39935
2025-12-01 09:28:52,328 - INFO -   Mapping DP01438 (DisProt)...
2025-12-01 09:28:54,190 - INFO -     -> O14936
2025-12-01 09:28:54,191 - INFO -   Mapping DP02128 (DisProt)...
2025-12-01 09:29:51,172 - WARNING - Job status is None for DP02128 after 30 attempts
2025-12-01 09:29:51,324 - WARNING -     -> Mapping failed
2025-12-01 09:29:51,325 - INFO -   Mapping IID00178 (IDEAL)...
2025-12-01 09:29:53,237 - INFO -     -> Q96J02
2025-12-01 09:29:53,239 - INFO -   Mapping DP01457 (DisProt)...
2025-12-01 09:29:55,050 - INFO -     -> Q92973
2025-12-01 09:29:55,051 - INFO -   Mapping DP03104 (DisProt)...
2025-12-01 09:30:52,144 - WARNING - Job status is None for DP03104 after 30 attempts
2025-12-01 09:30:52,299 - WARNING -     -> Mapping failed
2025-12-01 09:30:52,300 - INFO -   Mapping DP02132 (DisProt)...
2025-12-01 09:30:53,999 - INFO -     -> P04386
2025-12-01 09:30:54,002 - INFO -   Mapping IID50251 (IDEAL)...
2025-12-01 09:30:55,782 - INFO -     -> P34021
2025-12-01 09:30:55,784 - INFO -   Mapping IID00209 (IDEAL)...
2025-12-01 09:30:57,607 - INFO -     -> Q05086
2025-12-01 09:30:57,608 - INFO -   Mapping DP01202 (DisProt)...
2025-12-01 09:30:59,292 - INFO -     -> O55000
2025-12-01 09:30:59,294 - INFO -   Mapping DP02130 (DisProt)...
2025-12-01 09:31:56,467 - WARNING - Job status is None for DP02130 after 30 attempts
2025-12-01 09:31:56,624 - WARNING -     -> Mapping failed
2025-12-01 09:31:56,624 - INFO -   Mapping DP00959 (DisProt)...
2025-12-01 09:31:58,442 - INFO -     -> O15169
2025-12-01 09:31:58,442 - INFO -   Mapping DP00954 (DisProt)...
2025-12-01 09:32:00,185 - INFO -     -> Q9YGY0
2025-12-01 09:32:00,186 - INFO -   Mapping DP00961 (DisProt)...
2025-12-01 09:32:02,026 - INFO -     -> P52630
2025-12-01 09:32:02,027 - INFO -   Mapping DP00962 (DisProt)...
2025-12-01 09:32:03,915 - INFO -     -> P42224
2025-12-01 09:32:03,917 - INFO -   Mapping DP00341 (DisProt)...
2025-12-01 09:32:05,815 - INFO -     -> Q02248
2025-12-01 09:32:05,817 - INFO -   Mapping DP01628 (DisProt)...
2025-12-01 09:32:07,554 - INFO -     -> P14736
2025-12-01 09:32:07,556 - INFO -   Mapping IID00725 (IDEAL)...
2025-12-01 09:32:09,383 - INFO -     -> Q15022
2025-12-01 09:32:09,384 - INFO -   Mapping DP01618 (DisProt)...
2025-12-01 09:32:11,177 - INFO -     -> P03070
2025-12-01 09:32:11,178 - INFO -   Mapping DP02170 (DisProt)...
2025-12-01 09:32:12,996 - INFO -     -> O15234
2025-12-01 09:32:12,997 - INFO -   Mapping DP03131 (DisProt)...
2025-12-01 09:33:10,199 - WARNING - Job status is None for DP03131 after 30 attempts
2025-12-01 09:33:10,356 - WARNING -     -> Mapping failed
2025-12-01 09:33:10,357 - INFO -   Mapping IID90004 (IDEAL)...
2025-12-01 09:33:12,139 - INFO -     -> P03211
2025-12-01 09:33:12,141 - INFO -   Mapping DP00486 (DisProt)...
2025-12-01 09:33:13,989 - INFO -     -> Q9UBT2
2025-12-01 09:33:13,990 - INFO -   Mapping IID00714 (IDEAL)...
2025-12-01 09:33:15,877 - INFO -     -> P43405
2025-12-01 09:33:15,879 - INFO -   Mapping DP00134 (DisProt)...
2025-12-01 09:33:17,800 - INFO -     -> Q06787
2025-12-01 09:33:17,801 - INFO -   Mapping DP02249 (DisProt)...
2025-12-01 09:33:19,573 - INFO -     -> P38862
2025-12-01 09:33:19,573 - INFO -   Mapping DP00175 (DisProt)...
2025-12-01 09:33:21,811 - INFO -     -> Q9NQB0
2025-12-01 09:33:21,812 - INFO -   Mapping DP00767 (DisProt)...
2025-12-01 09:33:23,557 - INFO -     -> P27782
2025-12-01 09:33:23,559 - INFO -   Mapping IID50010 (IDEAL)...
2025-12-01 09:33:25,271 - INFO -     -> P70062
2025-12-01 09:33:25,272 - INFO -   Mapping DP01254 (DisProt)...
2025-12-01 09:33:27,163 - INFO -     -> P12956
2025-12-01 09:33:27,164 - INFO -   Mapping DP03007 (DisProt)...
2025-12-01 09:33:29,028 - INFO -     -> P97784
2025-12-01 09:33:29,030 - INFO -   Mapping DP00473 (DisProt)...
2025-12-01 09:33:30,783 - INFO -     -> Q49AN0
2025-12-01 09:33:30,784 - INFO -   Mapping DP00541 (DisProt)...
2025-12-01 09:33:32,495 - INFO -     -> Q91V27
2025-12-01 09:33:32,498 - INFO -   Mapping DP00342 (DisProt)...
2025-12-01 09:33:34,210 - INFO -     -> P09883
2025-12-01 09:33:34,210 - INFO -   Mapping DP00328 (DisProt)...
2025-12-01 09:33:35,912 - INFO -     -> Q08605
2025-12-01 09:33:35,914 - INFO -   Mapping DP00251 (DisProt)...
2025-12-01 09:33:37,721 - INFO -     -> O88339
2025-12-01 09:33:37,723 - INFO -   Mapping DP01070 (DisProt)...
2025-12-01 09:33:39,574 - INFO -     -> P42568
2025-12-01 09:33:39,575 - INFO -   Mapping IID00661 (IDEAL)...
2025-12-01 09:33:41,433 - INFO -     -> P54646
2025-12-01 09:33:41,434 - INFO -   Mapping DP00085 (DisProt)...
2025-12-01 09:33:43,323 - INFO -     -> Q04206
2025-12-01 09:33:43,324 - INFO -   Mapping IID50254 (IDEAL)...
2025-12-01 09:33:45,027 - INFO -     -> O08773
2025-12-01 09:33:45,030 - INFO -   Mapping DP00230 (DisProt)...
2025-12-01 09:33:46,784 - INFO -     -> Q14449
2025-12-01 09:33:46,786 - INFO -   Mapping DP01102 (DisProt)...
2025-12-01 09:33:48,646 - INFO -     -> P35637
2025-12-01 09:33:48,648 - INFO -   Mapping DP00133 (DisProt)...
2025-12-01 09:33:50,364 - INFO -     -> P03422
2025-12-01 09:33:50,367 - INFO -   Mapping IID50233 (IDEAL)...
2025-12-01 09:33:52,093 - INFO -     -> Q8CF89
2025-12-01 09:33:52,094 - INFO -   Mapping DP01806 (DisProt)...
2025-12-01 09:33:53,766 - INFO -     -> Q67953
2025-12-01 09:33:53,767 - INFO -   Mapping DP02415 (DisProt)...
2025-12-01 09:34:50,925 - WARNING - Job status is None for DP02415 after 30 attempts
2025-12-01 09:34:51,078 - WARNING -     -> Mapping failed
2025-12-01 09:34:51,079 - INFO -   Mapping IID50225 (IDEAL)...
2025-12-01 09:34:52,808 - INFO -     -> Q07794
2025-12-01 09:34:52,809 - INFO -   Mapping DP01764 (DisProt)...
2025-12-01 09:34:54,524 - INFO -     -> O95718
2025-12-01 09:34:54,526 - INFO -   Mapping IID00135 (IDEAL)...
2025-12-01 09:34:56,345 - INFO -     -> O15105
2025-12-01 09:34:56,347 - INFO -   Mapping DP01872 (DisProt)...
2025-12-01 09:34:58,182 - INFO -     -> O95630
2025-12-01 09:34:58,182 - INFO -   Mapping DP02269 (DisProt)...
2025-12-01 09:35:00,065 - INFO -     -> Q9Y6K9
2025-12-01 09:35:00,066 - INFO -   Mapping DP01400 (DisProt)...
2025-12-01 09:35:01,899 - INFO -     -> P45985
2025-12-01 09:35:01,902 - INFO -   Mapping DP01342 (DisProt)...
2025-12-01 09:35:03,728 - INFO -     -> P52564
2025-12-01 09:35:03,730 - INFO -   Mapping DP01326 (DisProt)...
2025-12-01 09:35:05,580 - INFO -     -> Q9Y4P1
2025-12-01 09:35:05,581 - INFO -   Mapping DP01252 (DisProt)...
2025-12-01 09:35:07,414 - INFO -     -> P01137
2025-12-01 09:35:07,415 - INFO -   Mapping DP01974 (DisProt)...
2025-12-01 09:35:09,240 - INFO -     -> P39748
2025-12-01 09:35:09,241 - INFO -   Mapping DP01047 (DisProt)...
2025-12-01 09:35:10,964 - INFO -     -> O50835
2025-12-01 09:35:10,965 - INFO -   Mapping IID00647 (IDEAL)...
2025-12-01 09:35:12,834 - INFO -     -> P02749
2025-12-01 09:35:12,835 - INFO -   Mapping DP00998 (DisProt)...
2025-12-01 09:35:14,553 - INFO -     -> Q05127
2025-12-01 09:35:14,554 - INFO -   Mapping DP00152 (DisProt)...
2025-12-01 09:35:16,420 - INFO -     -> Q13426
2025-12-01 09:35:16,421 - INFO -   Mapping IID00722 (IDEAL)...
2025-12-01 09:35:18,169 - INFO -     -> Q13291
2025-12-01 09:35:18,170 - INFO -   Mapping DP00173 (DisProt)...
2025-12-01 09:35:19,924 - INFO -     -> O00273
2025-12-01 09:35:19,925 - INFO -   Mapping IID50261 (IDEAL)...
2025-12-01 09:35:21,658 - INFO -     -> P48432
2025-12-01 09:35:21,659 - INFO -   Mapping IID00006 (IDEAL)...
2025-12-01 09:35:23,380 - INFO -     -> O15162
2025-12-01 09:35:23,381 - INFO -   Mapping DP03670 (DisProt)...
2025-12-01 09:36:20,872 - WARNING - Job status is None for DP03670 after 30 attempts
2025-12-01 09:36:21,029 - WARNING -     -> Mapping failed
2025-12-01 09:36:21,029 - INFO -   Mapping DP02761 (DisProt)...
2025-12-01 09:36:22,727 - INFO -     -> P25299
2025-12-01 09:36:22,729 - INFO -   Mapping DP01644 (DisProt)...
2025-12-01 09:37:19,963 - WARNING - Job status is None for DP01644 after 30 attempts
2025-12-01 09:37:20,120 - WARNING -     -> Mapping failed
2025-12-01 09:37:20,121 - INFO -   Mapping DP00631 (DisProt)...
2025-12-01 09:37:21,833 - INFO -     -> P38634
2025-12-01 09:37:21,836 - INFO -   Mapping DP03713 (DisProt)...
2025-12-01 09:38:18,821 - WARNING - Job status is None for DP03713 after 30 attempts
2025-12-01 09:38:18,978 - WARNING -     -> Mapping failed
2025-12-01 09:38:18,979 - INFO -   Mapping DP01533 (DisProt)...
2025-12-01 09:38:20,670 - INFO -     -> Q9NS23
2025-12-01 09:38:20,671 - INFO -   Mapping DP01271 (DisProt)...
2025-12-01 09:38:22,541 - INFO -     -> Q15691
2025-12-01 09:38:22,543 - INFO -   Mapping DP02886 (DisProt)...
2025-12-01 09:38:24,266 - INFO -     -> Q5QGG3
2025-12-01 09:38:24,267 - INFO -   Mapping DP00997 (DisProt)...
2025-12-01 09:38:25,940 - INFO -     -> P0A4T9
2025-12-01 09:38:25,941 - INFO -   Mapping DP01121 (DisProt)...
2025-12-01 09:38:27,589 - INFO -     -> Q38825
2025-12-01 09:38:27,590 - INFO -   Mapping DP00955 (DisProt)...
2025-12-01 09:38:29,285 - INFO -     -> P06836
2025-12-01 09:38:29,286 - INFO -   Mapping DP01456 (DisProt)...
2025-12-01 09:38:31,006 - INFO -     -> Q01081
2025-12-01 09:38:31,007 - INFO -   Mapping DP01499 (DisProt)...
2025-12-01 09:38:32,724 - INFO -     -> Q9JI51
2025-12-01 09:38:32,725 - INFO -   Mapping DP01834 (DisProt)...
2025-12-01 09:38:34,413 - INFO -     -> Q6F3E8
2025-12-01 09:38:34,414 - INFO -   Mapping IID00538 (IDEAL)...
2025-12-01 09:38:36,243 - INFO -     -> P10412
2025-12-01 09:38:36,244 - INFO -   Mapping DP03622 (DisProt)...
2025-12-01 09:39:33,423 - WARNING - Job status is None for DP03622 after 30 attempts
2025-12-01 09:39:33,579 - WARNING -     -> Mapping failed
2025-12-01 09:39:33,580 - INFO -   Mapping DP00552 (DisProt)...
2025-12-01 09:39:36,380 - INFO -     -> P0AFX7
2025-12-01 09:39:36,380 - INFO -   Mapping DP00166 (DisProt)...
2025-12-01 09:39:38,111 - INFO -     -> P19429
2025-12-01 09:39:38,113 - INFO -   Mapping DP01747 (DisProt)...
2025-12-01 09:39:39,838 - INFO -     -> P48788
2025-12-01 09:39:39,840 - INFO -   Mapping DP00506 (DisProt)...
2025-12-01 09:39:41,678 - INFO -     -> P07766
2025-12-01 09:39:41,679 - INFO -   Mapping IID00253 (IDEAL)...
2025-12-01 09:39:43,421 - INFO -     -> Q9HD42
2025-12-01 09:39:43,423 - INFO -   Mapping DP01661 (DisProt)...
2025-12-01 09:39:45,154 - INFO -     -> P70444
2025-12-01 09:39:45,156 - INFO -   Mapping DP01662 (DisProt)...
2025-12-01 09:39:46,877 - INFO -     -> P55957
2025-12-01 09:39:46,878 - INFO -   Mapping DP00875 (DisProt)...
2025-12-01 09:39:48,637 - INFO -     -> P69723
2025-12-01 09:39:48,639 - INFO -   Mapping DP02917 (DisProt)...
2025-12-01 09:39:50,373 - INFO -     -> Q02521
2025-12-01 09:39:50,376 - INFO -   Mapping DP00364 (DisProt)...
2025-12-01 09:39:52,243 - INFO -     -> Q15382
2025-12-01 09:39:52,244 - INFO -   Mapping DP00722 (DisProt)...
2025-12-01 09:39:53,952 - INFO -     -> P0AGE2
2025-12-01 09:39:53,953 - INFO -   Mapping IID00206 (IDEAL)...
2025-12-01 09:39:55,638 - INFO -     -> Q01658
2025-12-01 09:39:55,639 - INFO -   Mapping DP01967 (DisProt)...
2025-12-01 09:39:57,336 - INFO -     -> P0CF51
2025-12-01 09:39:57,337 - INFO -   Mapping DP01259 (DisProt)...
2025-12-01 09:39:59,114 - INFO -     -> P41208
2025-12-01 09:39:59,116 - INFO -   Mapping DP00469 (DisProt)...
2025-12-01 09:40:00,785 - INFO -     -> O24646
2025-12-01 09:40:00,788 - INFO -   Mapping DP00279 (DisProt)...
2025-12-01 09:40:02,459 - INFO -     -> P08523
2025-12-01 09:40:02,460 - INFO -   Mapping DP01615 (DisProt)...
2025-12-01 09:40:04,184 - INFO -     -> P03126
2025-12-01 09:40:04,186 - INFO -   Mapping DP02256 (DisProt)...
2025-12-01 09:40:05,866 - INFO -     -> P26554
2025-12-01 09:40:05,869 - INFO -   Mapping DP01498 (DisProt)...
2025-12-01 09:40:07,594 - INFO -     -> O70480
2025-12-01 09:40:07,596 - INFO -   Mapping DP02079 (DisProt)...
2025-12-01 09:40:09,282 - INFO -     -> E1BSW7
2025-12-01 09:40:09,284 - INFO -   Mapping DP00534 (DisProt)...
2025-12-01 09:40:11,000 - INFO -     -> Q9LZP9
2025-12-01 09:40:11,003 - INFO -   Mapping DP00709 (DisProt)...
2025-12-01 09:40:12,769 - INFO -     -> Q9Y3M2
2025-12-01 09:40:12,770 - INFO -   Mapping DP02949 (DisProt)...
2025-12-01 09:40:14,480 - INFO -     -> O25555
2025-12-01 09:40:14,481 - INFO -   Mapping DP01293 (DisProt)...
2025-12-01 09:40:16,232 - INFO -     -> Q13542
2025-12-01 09:40:16,233 - INFO -   Mapping DP00028 (DisProt)...
2025-12-01 09:40:18,006 - INFO -     -> Q13541
2025-12-01 09:40:18,007 - INFO -   Mapping DP00424 (DisProt)...
2025-12-01 09:40:19,693 - INFO -     -> P04325
2025-12-01 09:40:19,694 - INFO -   Mapping DP01600 (DisProt)...
2025-12-01 09:40:21,367 - INFO -     -> Q93KQ4
2025-12-01 09:40:21,368 - INFO -   Mapping DP01243 (DisProt)...
2025-12-01 09:40:23,077 - INFO -     -> P25638
2025-12-01 09:40:23,079 - INFO -   Mapping DP01087 (DisProt)...
2025-12-01 09:40:24,831 - INFO -     -> Q1PAB4
2025-12-01 09:40:24,832 - INFO -   Mapping DP00024 (DisProt)...
2025-12-01 09:40:26,641 - INFO -     -> P03129
2025-12-01 09:40:26,643 - INFO -   Mapping DP00422 (DisProt)...
2025-12-01 09:40:28,350 - INFO -     -> P0A6R3
2025-12-01 09:40:28,350 - INFO -   Mapping DP01488 (DisProt)...
2025-12-01 09:40:30,067 - INFO -     -> P69346
2025-12-01 09:40:30,069 - INFO -   Mapping DP00833 (DisProt)...
2025-12-01 09:40:31,759 - INFO -     -> P22995
2025-12-01 09:40:31,761 - INFO -   Mapping DP00015 (DisProt)...
2025-12-01 09:40:33,453 - INFO -     -> P61926
2025-12-01 09:40:33,454 - INFO -   Mapping DP01296 (DisProt)...
2025-12-01 09:40:35,178 - INFO -     -> Q6BBK3
2025-12-01 09:40:35,181 - INFO -   Mapping DP01512 (DisProt)...
2025-12-01 09:40:36,867 - INFO -     -> P03050
2025-12-01 09:40:36,870 - INFO -   Mapping DP01116 (DisProt)...
2025-12-01 09:40:38,809 - INFO -     -> Q03164
2025-12-01 09:40:38,811 - INFO -   Mapping DP01104 (DisProt)...
2025-12-01 09:40:40,757 - INFO -     -> P46531
2025-12-01 09:40:40,758 - INFO -   Mapping DP02004 (DisProt)...
2025-12-01 09:40:42,677 - INFO -     -> Q92793
2025-12-01 09:40:42,679 - INFO -   Mapping DP00081 (DisProt)...
2025-12-01 09:40:44,547 - INFO -     -> P51123
2025-12-01 09:40:44,548 - INFO -   Mapping IID50249 (IDEAL)...
2025-12-01 09:40:46,292 - INFO -     -> Q9WUI9
2025-12-01 09:40:46,294 - INFO -   Mapping IID00664 (IDEAL)...
2025-12-01 09:40:48,239 - INFO -     -> Q12879
2025-12-01 09:40:48,241 - INFO -   Mapping IID50042 (IDEAL)...
2025-12-01 09:40:50,068 - INFO -     -> P23615
2025-12-01 09:40:50,070 - INFO -   Mapping IID50334 (IDEAL)...
2025-12-01 09:40:51,772 - INFO -     -> Q63155
2025-12-01 09:40:51,773 - INFO -   Mapping DP00410 (DisProt)...
2025-12-01 09:40:53,676 - INFO -     -> P12497
2025-12-01 09:40:53,677 - INFO -   Mapping DP00343 (DisProt)...
2025-12-01 09:40:55,445 - INFO -     -> Q9Y6Q9
2025-12-01 09:40:55,446 - INFO -   Mapping DP02613 (DisProt)...
2025-12-01 09:40:57,187 - INFO -     -> Q8K368
2025-12-01 09:40:57,188 - INFO -   Mapping DP02030 (DisProt)...
2025-12-01 09:40:58,879 - INFO -     -> P09546
2025-12-01 09:40:58,881 - INFO -   Mapping DP00949 (DisProt)...
2025-12-01 09:41:00,680 - INFO -     -> Q9HAU5
2025-12-01 09:41:00,682 - INFO -   Mapping DP00418 (DisProt)...
2025-12-01 09:41:02,595 - INFO -     -> P78504
2025-12-01 09:41:02,596 - INFO -   Mapping DP02349 (DisProt)...
2025-12-01 09:41:04,329 - INFO -     -> P51825
2025-12-01 09:41:04,330 - INFO -   Mapping DP01463 (DisProt)...
2025-12-01 09:41:06,156 - INFO -     -> Q9UHB7
2025-12-01 09:41:06,158 - INFO -   Mapping DP02829 (DisProt)...
2025-12-01 09:41:08,020 - INFO -     -> P46379
2025-12-01 09:41:08,022 - INFO -   Mapping IID00130 (IDEAL)...
2025-12-01 09:41:09,782 - INFO -     -> P28749
2025-12-01 09:41:09,784 - INFO -   Mapping DP00207 (DisProt)...
2025-12-01 09:41:11,656 - INFO -     -> P21513
2025-12-01 09:41:11,657 - INFO -   Mapping DP01772 (DisProt)...
2025-12-01 09:41:13,524 - INFO -     -> Q07912
2025-12-01 09:41:13,525 - INFO -   Mapping DP00025 (DisProt)...
2025-12-01 09:41:15,242 - INFO -     -> P14738
2025-12-01 09:41:15,243 - INFO -   Mapping DP00177 (DisProt)...
2025-12-01 09:41:16,992 - INFO -     -> Q9Y5B0
2025-12-01 09:41:16,994 - INFO -   Mapping DP01626 (DisProt)...
2025-12-01 09:41:18,852 - INFO -     -> Q01831
2025-12-01 09:41:18,853 - INFO -   Mapping IID50259 (IDEAL)...
2025-12-01 09:41:20,545 - INFO -     -> P87314
2025-12-01 09:41:20,546 - INFO -   Mapping DP01426 (DisProt)...
2025-12-01 09:41:22,495 - INFO -     -> P06400
2025-12-01 09:41:22,496 - INFO -   Mapping DP01368 (DisProt)...
2025-12-01 09:41:24,175 - INFO -     -> Q8WXE9
2025-12-01 09:41:24,176 - INFO -   Mapping DP01977 (DisProt)...
2025-12-01 09:41:25,986 - INFO -     -> P49736
2025-12-01 09:41:25,990 - INFO -   Mapping DP00159 (DisProt)...
2025-12-01 09:41:27,745 - INFO -     -> P09803
2025-12-01 09:41:27,746 - INFO -   Mapping IID00105 (IDEAL)...
2025-12-01 09:41:29,548 - INFO -     -> Q9UBT6
2025-12-01 09:41:29,550 - INFO -   Mapping DP02626 (DisProt)...
2025-12-01 09:41:31,257 - INFO -     -> Q9QUG2
2025-12-01 09:41:31,259 - INFO -   Mapping DP01551 (DisProt)...
2025-12-01 09:41:33,185 - INFO -     -> Q99523
2025-12-01 09:41:33,186 - INFO -   Mapping DP00262 (DisProt)...
2025-12-01 09:41:35,086 - INFO -     -> Q16665
2025-12-01 09:41:35,088 - INFO -   Mapping DP01280 (DisProt)...
2025-12-01 09:41:37,118 - INFO -     -> P05067
2025-12-01 09:41:37,121 - INFO -   Mapping DP01224 (DisProt)...
2025-12-01 09:41:38,842 - INFO -     -> O43312
2025-12-01 09:41:38,842 - INFO -   Mapping IID00066 (IDEAL)...
2025-12-01 09:41:40,816 - INFO -     -> Q02156
2025-12-01 09:41:40,817 - INFO -   Mapping DP01508 (DisProt)...
2025-12-01 09:41:42,629 - INFO -     -> Q15418
2025-12-01 09:41:42,630 - INFO -   Mapping IID00571 (IDEAL)...
2025-12-01 09:41:44,416 - INFO -     -> Q71RC2
2025-12-01 09:41:44,417 - INFO -   Mapping IID00108 (IDEAL)...
2025-12-01 09:41:46,244 - INFO -     -> Q9Y253
2025-12-01 09:41:46,245 - INFO -   Mapping DP01199 (DisProt)...
2025-12-01 09:41:48,075 - INFO -     -> B9KDD4
2025-12-01 09:41:48,077 - INFO -   Mapping DP03290 (DisProt)...
2025-12-01 09:42:45,216 - WARNING - Job status is None for DP03290 after 30 attempts
2025-12-01 09:42:45,373 - WARNING -     -> Mapping failed
2025-12-01 09:42:45,374 - INFO -   Mapping DP02192 (DisProt)...
2025-12-01 09:42:47,312 - INFO -     -> O00571
2025-12-01 09:42:47,313 - INFO -   Mapping DP00171 (DisProt)...
2025-12-01 09:43:44,389 - WARNING - Job status is None for DP00171 after 30 attempts
2025-12-01 09:43:44,545 - WARNING -     -> Mapping failed
2025-12-01 09:43:44,546 - INFO -   Mapping IID00226 (IDEAL)...
2025-12-01 09:43:46,291 - INFO -     -> Q9UKV5
2025-12-01 09:43:46,293 - INFO -   Mapping DP00472 (DisProt)...
2025-12-01 09:43:48,156 - INFO -     -> P50542
2025-12-01 09:43:48,157 - INFO -   Mapping DP01449 (DisProt)...
2025-12-01 09:43:49,992 - INFO -     -> Q15637
2025-12-01 09:43:49,995 - INFO -   Mapping DP04142 (DisProt)...
2025-12-01 09:44:47,229 - WARNING - Job status is None for DP04142 after 30 attempts
2025-12-01 09:44:47,384 - WARNING -     -> Mapping failed
2025-12-01 09:44:47,386 - INFO -   Mapping DP03377 (DisProt)...
2025-12-01 09:44:49,076 - INFO -     -> Q7T2G3
2025-12-01 09:44:49,078 - INFO -   Mapping DP01675 (DisProt)...
2025-12-01 09:44:50,896 - INFO -     -> O75928
2025-12-01 09:44:50,897 - INFO -   Mapping DP01451 (DisProt)...
2025-12-01 09:44:52,764 - INFO -     -> Q9UBU9
2025-12-01 09:44:52,765 - INFO -   Mapping IID00074 (IDEAL)...
2025-12-01 09:44:54,493 - INFO -     -> Q13772
2025-12-01 09:44:54,494 - INFO -   Mapping DP02839 (DisProt)...
2025-12-01 09:44:56,671 - INFO -     -> O43070
2025-12-01 09:44:56,673 - INFO -   Mapping IID00332 (IDEAL)...
2025-12-01 09:44:58,505 - INFO -     -> Q9UIS9
2025-12-01 09:44:58,506 - INFO -   Mapping IID00381 (IDEAL)...
2025-12-01 09:45:00,301 - INFO -     -> Q06455
2025-12-01 09:45:00,302 - INFO -   Mapping DP02653 (DisProt)...
2025-12-01 09:45:02,038 - INFO -     -> P61765
2025-12-01 09:45:02,039 - INFO -   Mapping DP00768 (DisProt)...
2025-12-01 09:45:03,732 - INFO -     -> Q28181
2025-12-01 09:45:03,733 - INFO -   Mapping DP03709 (DisProt)...
2025-12-01 09:46:01,930 - WARNING - Job status is None for DP03709 after 30 attempts
2025-12-01 09:46:02,087 - WARNING -     -> Mapping failed
2025-12-01 09:46:02,087 - INFO -   Mapping DP00618 (DisProt)...
2025-12-01 09:46:03,829 - INFO -     -> P53954
2025-12-01 09:46:03,832 - INFO -   Mapping DP01313 (DisProt)...
2025-12-01 09:46:05,506 - INFO -     -> Q9N4U5
2025-12-01 09:46:05,507 - INFO -   Mapping DP02227 (DisProt)...
2025-12-01 09:46:07,264 - INFO -     -> Q02821
2025-12-01 09:46:07,266 - INFO -   Mapping IID50009 (IDEAL)...
2025-12-01 09:46:09,029 - INFO -     -> P52293
2025-12-01 09:46:09,030 - INFO -   Mapping IID00503 (IDEAL)...
2025-12-01 09:46:10,775 - INFO -     -> Q9NZN8
2025-12-01 09:46:10,776 - INFO -   Mapping DP00608 (DisProt)...
2025-12-01 09:46:12,631 - INFO -     -> Q13573
2025-12-01 09:46:12,632 - INFO -   Mapping DP01751 (DisProt)...
2025-12-01 09:46:14,463 - INFO -     -> O43172
2025-12-01 09:46:14,464 - INFO -   Mapping DP00702 (DisProt)...
2025-12-01 09:46:16,521 - INFO -     -> P46937
2025-12-01 09:46:16,522 - INFO -   Mapping DP01172 (DisProt)...
2025-12-01 09:46:18,362 - INFO -     -> O43516
2025-12-01 09:46:18,363 - INFO -   Mapping DP00539 (DisProt)...
2025-12-01 09:46:20,247 - INFO -     -> P51608
2025-12-01 09:46:20,248 - INFO -   Mapping DP03358 (DisProt)...
2025-12-01 09:47:17,761 - WARNING - Job status is None for DP03358 after 30 attempts
2025-12-01 09:47:17,913 - WARNING -     -> Mapping failed
2025-12-01 09:47:17,914 - INFO -   Mapping DP02913 (DisProt)...
2025-12-01 09:47:19,747 - INFO -     -> P04004
2025-12-01 09:47:19,747 - INFO -   Mapping IID00180 (IDEAL)...
2025-12-01 09:47:21,548 - INFO -     -> Q9BSI4
2025-12-01 09:47:21,549 - INFO -   Mapping DP01149 (DisProt)...
2025-12-01 09:47:23,381 - INFO -     -> Q14457
2025-12-01 09:47:23,382 - INFO -   Mapping IID00316 (IDEAL)...
2025-12-01 09:47:25,107 - INFO -     -> Q07960
2025-12-01 09:47:25,108 - INFO -   Mapping DP00455 (DisProt)...
2025-12-01 09:47:26,814 - INFO -     -> P84092
2025-12-01 09:47:26,814 - INFO -   Mapping DP02898 (DisProt)...
2025-12-01 09:47:28,515 - INFO -     -> P35585
2025-12-01 09:47:28,516 - INFO -   Mapping DP00385 (DisProt)...
2025-12-01 09:47:30,411 - INFO -     -> P49841
2025-12-01 09:47:30,412 - INFO -   Mapping DP00333 (DisProt)...
2025-12-01 09:48:27,494 - WARNING - Job status is None for DP00333 after 30 attempts
2025-12-01 09:48:27,649 - WARNING -     -> Mapping failed
2025-12-01 09:48:27,651 - INFO -   Mapping DP03677 (DisProt)...
2025-12-01 09:49:24,635 - WARNING - Job status is None for DP03677 after 30 attempts
2025-12-01 09:49:24,791 - WARNING -     -> Mapping failed
2025-12-01 09:49:24,792 - INFO -   Mapping IID00352 (IDEAL)...
2025-12-01 09:49:26,523 - INFO -     -> Q14242
2025-12-01 09:49:26,525 - INFO -   Mapping DP01155 (DisProt)...
2025-12-01 09:49:28,232 - INFO -     -> O66858
2025-12-01 09:49:28,234 - INFO -   Mapping DP00324 (DisProt)...
2025-12-01 09:49:30,069 - INFO -     -> P09651
2025-12-01 09:49:30,071 - INFO -   Mapping DP02301 (DisProt)...
2025-12-01 09:49:31,802 - INFO -     -> Q71UI9
2025-12-01 09:49:31,804 - INFO -   Mapping IID00027 (IDEAL)...
2025-12-01 09:49:33,592 - INFO -     -> P16104
2025-12-01 09:49:33,594 - INFO -   Mapping IID00593 (IDEAL)...
2025-12-01 09:49:35,337 - INFO -     -> Q15080
2025-12-01 09:49:35,339 - INFO -   Mapping DP02209 (DisProt)...
2025-12-01 09:49:37,073 - INFO -     -> O82132
2025-12-01 09:49:37,075 - INFO -   Mapping DP00397 (DisProt)...
2025-12-01 09:49:38,807 - INFO -     -> Q9ES89
2025-12-01 09:49:38,810 - INFO -   Mapping DP00625 (DisProt)...
2025-12-01 09:49:40,533 - INFO -     -> P45976
2025-12-01 09:49:40,534 - INFO -   Mapping DP03512 (DisProt)...
2025-12-01 09:50:37,459 - WARNING - Job status is None for DP03512 after 30 attempts
2025-12-01 09:50:37,613 - WARNING -     -> Mapping failed
2025-12-01 09:50:37,613 - INFO -   Mapping DP00236 (DisProt)...
2025-12-01 09:50:39,426 - INFO -     -> P02686
2025-12-01 09:50:39,427 - INFO -   Mapping IID00081 (IDEAL)...
2025-12-01 09:50:41,166 - INFO -     -> Q15466
2025-12-01 09:50:41,168 - INFO -   Mapping DP00008 (DisProt)...
2025-12-01 09:50:42,870 - INFO -     -> Q64693
2025-12-01 09:50:42,871 - INFO -   Mapping DP01500 (DisProt)...
2025-12-01 09:50:44,581 - INFO -     -> Q5R6Q2
2025-12-01 09:50:44,582 - INFO -   Mapping DP00694 (DisProt)...
2025-12-01 09:50:46,322 - INFO -     -> Q8N488
2025-12-01 09:50:46,325 - INFO -   Mapping DP00926 (DisProt)...
2025-12-01 09:50:48,071 - INFO -     -> Q9BQB4
2025-12-01 09:50:48,073 - INFO -   Mapping DP02806 (DisProt)...
2025-12-01 09:50:49,818 - INFO -     -> P0CY08
2025-12-01 09:50:49,819 - INFO -   Mapping DP02889 (DisProt)...
2025-12-01 09:50:51,552 - INFO -     -> P03407
2025-12-01 09:50:51,553 - INFO -   Mapping DP01873 (DisProt)...
2025-12-01 09:50:53,282 - INFO -     -> Q99075
2025-12-01 09:50:53,283 - INFO -   Mapping DP02417 (DisProt)...
2025-12-01 09:50:54,980 - INFO -     -> P49765
2025-12-01 09:50:54,981 - INFO -   Mapping DP00068 (DisProt)...
2025-12-01 09:51:52,099 - WARNING - Job status is None for DP00068 after 30 attempts
2025-12-01 09:51:52,254 - WARNING -     -> Mapping failed
2025-12-01 09:51:52,255 - INFO -   Mapping DP02849 (DisProt)...
2025-12-01 09:51:54,017 - INFO -     -> O43521
2025-12-01 09:51:54,018 - INFO -   Mapping DP04134 (DisProt)...
2025-12-01 09:52:51,097 - WARNING - Job status is None for DP04134 after 30 attempts
2025-12-01 09:52:51,254 - WARNING -     -> Mapping failed
2025-12-01 09:52:51,254 - INFO -   Mapping DP01794 (DisProt)...
2025-12-01 09:52:52,979 - INFO -     -> Q99ML1
2025-12-01 09:52:52,982 - INFO -   Mapping DP02540 (DisProt)...
2025-12-01 09:52:54,771 - INFO -     -> Q07812
2025-12-01 09:52:54,773 - INFO -   Mapping DP00138 (DisProt)...
2025-12-01 09:52:56,492 - INFO -     -> P12272
2025-12-01 09:52:56,495 - INFO -   Mapping DP01187 (DisProt)...
2025-12-01 09:52:58,231 - INFO -     -> P34087
2025-12-01 09:52:58,232 - INFO -   Mapping DP00335 (DisProt)...
2025-12-01 09:52:59,921 - INFO -     -> Q64364
2025-12-01 09:52:59,922 - INFO -   Mapping DP02167 (DisProt)...
2025-12-01 09:53:01,655 - INFO -     -> Q8N726
2025-12-01 09:53:01,657 - INFO -   Mapping DP00016 (DisProt)...
2025-12-01 09:53:03,476 - INFO -     -> P38936
2025-12-01 09:53:03,477 - INFO -   Mapping DP00393 (DisProt)...
2025-12-01 09:53:05,188 - INFO -     -> P52298
2025-12-01 09:53:05,189 - INFO -   Mapping DP03853 (DisProt)...
2025-12-01 09:54:02,209 - WARNING - Job status is None for DP03853 after 30 attempts
2025-12-01 09:54:02,365 - WARNING -     -> Mapping failed
2025-12-01 09:54:02,366 - INFO -   Mapping DP00357 (DisProt)...
2025-12-01 09:54:04,096 - INFO -     -> P62328
2025-12-01 09:54:04,098 - INFO -   Mapping DP00113 (DisProt)...
2025-12-01 09:54:05,823 - INFO -     -> P31109
2025-12-01 09:54:05,824 - INFO -   Mapping DP01502 (DisProt)...
2025-12-01 09:54:07,547 - INFO -     -> P33328
2025-12-01 09:54:07,548 - INFO -   Mapping DP01407 (DisProt)...
2025-12-01 09:54:09,271 - INFO -     -> O61667
2025-12-01 09:54:09,273 - INFO -   Mapping DP03419 (DisProt)...
2025-12-01 09:54:10,976 - INFO -     -> A1B602
2025-12-01 09:54:10,977 - INFO -   Mapping DP00432 (DisProt)...
2025-12-01 09:54:12,704 - INFO -     -> P11632
2025-12-01 09:54:12,706 - INFO -   Mapping DP02901 (DisProt)...
2025-12-01 09:54:14,403 - INFO -     -> J7QA90
2025-12-01 09:54:14,404 - INFO -   Mapping DP01291 (DisProt)...
2025-12-01 09:54:16,102 - INFO -     -> P0AE72
2025-12-01 09:54:16,103 - INFO -   Mapping DP00975 (DisProt)...
2025-12-01 09:54:17,790 - INFO -     -> Q86FP9
2025-12-01 09:54:17,791 - INFO -   Mapping DP02950 (DisProt)...
2025-12-01 09:54:19,528 - INFO -     -> P0C079
2025-12-01 09:54:19,529 - INFO -   Mapping DP01643 (DisProt)...
2025-12-01 09:54:21,218 - INFO -     -> O75506
2025-12-01 09:54:21,221 - INFO -   Mapping DP00288 (DisProt)...
2025-12-01 09:54:22,957 - INFO -     -> Q06253
2025-12-01 09:54:22,960 - INFO -   Mapping DP00877 (DisProt)...
2025-12-01 09:54:24,635 - INFO -     -> P9WHN5
2025-12-01 09:54:24,636 - INFO -   Mapping DP00878 (DisProt)...
2025-12-01 09:54:26,308 - INFO -     -> G8HXD9
2025-12-01 09:54:26,316 - INFO -   Mapping complete. 669 IDs have UniProt mappings
2025-12-01 09:54:26,316 - INFO - Saving compiled MoRF data to data/MoRF2/morf_interfaces.csv...
2025-12-01 09:54:26,348 - INFO -  Successfully saved 713 rows
2025-12-01 09:54:26,348 - INFO - 
2025-12-01 09:54:26,348 - INFO - ================================================================================
2025-12-01 09:54:26,348 - INFO - Summary
2025-12-01 09:54:26,348 - INFO - ================================================================================
2025-12-01 09:54:26,348 - INFO - Total MoRF entries: 713
2025-12-01 09:54:26,349 - INFO -   - UniProt IDs: 237
2025-12-01 09:54:26,349 - INFO -   - Disprot IDs: 386
2025-12-01 09:54:26,350 - INFO -   - Ideal IDs: 90
2025-12-01 09:54:26,351 - INFO - Successfully mapped IDs: 669
2025-12-01 09:54:26,351 - INFO - Output file: data/MoRF2/morf_interfaces.csv
2025-12-01 09:54:26,351 - INFO - 
